{"$schema":"https://json-schema.org/draft/2020-12/schema","$id":"https://gwc.local/schemas/integrations/task-me-task-package.schema.json","type":"object","additionalProperties":false,"required":["schema_version","task_id","title","objective","output_folder","owner_root","dependencies","complexity","risk","effort","implementation_steps","validation","artifact_id","parent_artifact_id","source_repo","source_ref","source_sha","tool_package","tool_source_commit","generated_at"],"properties":{"schema_version":{"type":"string"},"task_id":{"type":"string"},"title":{"type":"string"},"objective":{"type":"string"},"output_folder":{"type":"string","pattern":"^\\.task-me/"},"owner_root":{"const":".task-me"},"dependencies":{"type":"array"},"complexity":{"type":"string"},"risk":{"type":"string"},"effort":{"type":"object"},"implementation_steps":{"type":"array"},"validation":{"type":"array"},"artifact_id":{"type":"string"},"parent_artifact_id":{"type":["string","null"]},"source_repo":{"type":"string"},"source_ref":{"type":"string"},"source_sha":{"type":"string"},"tool_package":{"type":"string"},"tool_source_commit":{"type":"string"},"generated_at":{"type":"string"}}}
