{"schema_version":"1.0","task_id":"SCRUM-118-PLAN-1","title":"Task-Me host-mode contract validation","objective":"Verify bounded Task-Me host outputs","output_folder":".task-me/runs/scrum-118/task-package","owner_root":".task-me","dependencies":[],"complexity":"M","risk":"R2","effort":{"estimate":"S","assumptions":["contract-only scope"]},"implementation_steps":["validate request","produce task package","run tests"],"validation":["python -m unittest tests/test_task_me_host_contract.py"],"artifact_id":"task-package-r2","parent_artifact_id":null,"source_repo":"nhatnguyenquang1838-coder/gwc","source_ref":"main","source_sha":"e0031b01ea9ea4f72a1119a81d732bbaee2b4921","tool_package":"task-me@main-pinned","tool_source_commit":"187586fb124a2687fef70c1c4a3a3b8b2cd02b09","generated_at":"2026-07-28T00:35:00+07:00"}
